{
  "schemaVersion": 1,
  "issue": 141,
  "sourceCommit": "d4bab4ede21cae2b25f03a40f466b52dceadfda2",
  "productVersion": "0.1.0-beta.8",
  "measuredAt": "2026-09-25",
  "provenance": {
    "performanceRun": "36186305008",
    "performanceSummaryPath": "/private/tmp/claude-501/-Users-minhokang-orca-workspaces-redact-secret-beta-9-third-iteration/7f8aa07b-eb69-49ea-bd86-52734e2d0c35/scratchpad/q772/perf/36186305008/performance-evaluation-d4bab4ede21cae2b25f03a40f466b52dceadfda2/summary.json",
    "qualificationRun": "36181706528",
    "repetitions": 5,
    "workloadProfiles": {
      "version": "1",
      "hash": "b4db2cd22b4c008c9d63789df8ca2e21e697a21a84699466ea5f96c89d8e2806"
    },
    "officialProfile": "linux-x64 release builds (performance workflow on ubuntu-latest)",
    "buildProfile": "release for every surface: napi build --release (Node addon), build-browser-artifact.mjs default release profile (wasm), cargo build --release (CLI and Rust core), maturin build --release (Python); only the Rust core result records it in its own provenance, the others report null"
  },
  "measurements": {
    "timings": [
      {
        "surface": "browser-wasm",
        "profileId": "scale-logs-medium-fixed4096",
        "path": "incremental",
        "environment": {
          "os": "linux-6.17.0-1022-azure",
          "cpu": "x64",
          "runtime": "chromium-153.0.8010.12",
          "buildProfile": null,
          "artifactIdentity": "@redact-secret/wasm@0.1.0-beta.8"
        },
        "initialization": {
          "median": 14.599999999976717,
          "p95": 15.299999999988358,
          "minimum": 14.5,
          "maximum": 15.299999999988358,
          "standardDeviation": 0.29933259093989295,
          "samples": 5,
          "unit": "milliseconds"
        },
        "processing": {
          "median": 105.20000000001164,
          "p95": 118.5,
          "minimum": 103.20000000001164,
          "maximum": 118.5,
          "standardDeviation": 5.607994293858495,
          "samples": 5,
          "unit": "milliseconds"
        },
        "throughput": {
          "median": 2491958.1749046673,
          "minimum": 2212270.042194093,
          "unit": "bytes-per-second"
        },
        "memory": {
          "nodeHeap": {
            "unavailableReason": "A browser process does not expose Node heapUsed."
          },
          "nodeRss": {
            "unavailableReason": "Browser pages do not expose process RSS through a standard API."
          },
          "nodeExternal": {
            "unavailableReason": "Browser pages do not expose Node external memory."
          },
          "browserJsHeap": {
            "maximumObservedBytes": 39600000,
            "maximumGrowthBytes": 0,
            "samples": 5,
            "unit": "bytes"
          },
          "wasmLinearMemory": {
            "unavailableReason": "The package intentionally keeps its WebAssembly.Memory handle private; the test harness cannot read linear-memory size without adding product instrumentation."
          },
          "pythonHeap": {
            "unavailableReason": "The browser surface does not run inside a Python allocator."
          },
          "processRss": {
            "unavailableReason": "Browser pages do not expose whole-process RSS through a standard API."
          },
          "streamingBuffer": {
            "unavailableReason": "The public incremental session exposes lifecycle state but intentionally does not expose retained plaintext buffer size."
          }
        }
      },
      {
        "surface": "browser-wasm",
        "profileId": "scale-logs-small-whole",
        "path": "whole-input",
        "environment": {
          "os": "linux-6.17.0-1022-azure",
          "cpu": "x64",
          "runtime": "chromium-153.0.8010.12",
          "buildProfile": null,
          "artifactIdentity": "@redact-secret/wasm@0.1.0-beta.8"
        },
        "initialization": {
          "median": 9.100000000034925,
          "p95": 14.299999999988358,
          "minimum": 8.199999999953434,
          "maximum": 14.299999999988358,
          "standardDeviation": 2.2668039174161754,
          "samples": 5,
          "unit": "milliseconds"
        },
        "processing": {
          "median": 22.79999999998836,
          "p95": 33.40000000002328,
          "minimum": 19.100000000034925,
          "maximum": 33.40000000002328,
          "standardDeviation": 4.8823764705331785,
          "samples": 5,
          "unit": "milliseconds"
        },
        "throughput": {
          "median": 2875175.4385979595,
          "minimum": 1962694.6107770747,
          "unit": "bytes-per-second"
        },
        "memory": {
          "nodeHeap": {
            "unavailableReason": "A browser process does not expose Node heapUsed."
          },
          "nodeRss": {
            "unavailableReason": "Browser pages do not expose process RSS through a standard API."
          },
          "nodeExternal": {
            "unavailableReason": "Browser pages do not expose Node external memory."
          },
          "browserJsHeap": {
            "maximumObservedBytes": 10000000,
            "maximumGrowthBytes": 0,
            "samples": 5,
            "unit": "bytes"
          },
          "wasmLinearMemory": {
            "unavailableReason": "The package intentionally keeps its WebAssembly.Memory handle private; the test harness cannot read linear-memory size without adding product instrumentation."
          },
          "pythonHeap": {
            "unavailableReason": "The browser surface does not run inside a Python allocator."
          },
          "processRss": {
            "unavailableReason": "Browser pages do not expose whole-process RSS through a standard API."
          },
          "streamingBuffer": {
            "unavailableReason": "The public incremental session exposes lifecycle state but intentionally does not expose retained plaintext buffer size."
          }
        }
      },
      {
        "surface": "cli",
        "profileId": "scale-logs-medium-fixed4096",
        "path": "standard-input",
        "environment": {
          "os": "linux-6.17.0-1022-azure",
          "cpu": "x64",
          "runtime": "rustc 1.98.1 (48a229cea 2026-09-01)",
          "buildProfile": null,
          "artifactIdentity": "redact-secret@0.1.0-beta.8"
        },
        "initialization": {
          "median": 2.4474889999999903,
          "p95": 2.958712999999989,
          "minimum": 2.3032490000000507,
          "maximum": 2.958712999999989,
          "standardDeviation": 0.28119838079164844,
          "samples": 5,
          "unit": "milliseconds"
        },
        "processing": {
          "median": 83.92550399999999,
          "p95": 87.27140499999996,
          "minimum": 83.69436300000001,
          "maximum": 87.27140499999996,
          "standardDeviation": 1.3661337389677364,
          "samples": 5,
          "unit": "milliseconds"
        },
        "throughput": {
          "median": 3123651.184745939,
          "minimum": 3003893.42878117,
          "unit": "bytes-per-second"
        },
        "memory": {
          "nodeHeap": {
            "unavailableReason": "The CLI is a native process, not a Node.js process."
          },
          "nodeRss": {
            "unavailableReason": "The CLI is a native process, not a Node.js process."
          },
          "nodeExternal": {
            "unavailableReason": "The CLI is a native process, not a Node.js process."
          },
          "browserJsHeap": {
            "unavailableReason": "The CLI is a native process, not a browser JavaScript environment."
          },
          "wasmLinearMemory": {
            "unavailableReason": "The CLI is a native process and does not use WebAssembly linear memory."
          },
          "pythonHeap": {
            "unavailableReason": "The CLI is a native process, not a Python allocator."
          },
          "processRss": {
            "maximumObservedBytes": 3260416,
            "maximumGrowthBytes": 3260416,
            "samples": 5,
            "unit": "bytes"
          },
          "streamingBuffer": {
            "unavailableReason": "The CLI's standard-input path streams through the incremental core, but the public contract exposes no retained plaintext buffer size."
          }
        }
      },
      {
        "surface": "cli",
        "profileId": "scale-logs-small-whole",
        "path": "whole-input",
        "environment": {
          "os": "linux-6.17.0-1022-azure",
          "cpu": "x64",
          "runtime": "rustc 1.98.1 (48a229cea 2026-09-01)",
          "buildProfile": null,
          "artifactIdentity": "redact-secret@0.1.0-beta.8"
        },
        "initialization": {
          "median": 2.3396869999999126,
          "p95": 2.8047949999999986,
          "minimum": 2.2139419999999745,
          "maximum": 2.8047949999999986,
          "standardDeviation": 0.21114822612507167,
          "samples": 5,
          "unit": "milliseconds"
        },
        "processing": {
          "median": 23.17938499999991,
          "p95": 32.287172,
          "minimum": 22.933001999999988,
          "maximum": 32.287172,
          "standardDeviation": 3.6514183507841356,
          "samples": 5,
          "unit": "milliseconds"
        },
        "throughput": {
          "median": 2828116.449163783,
          "minimum": 2030341.9574808227,
          "unit": "bytes-per-second"
        },
        "memory": {
          "nodeHeap": {
            "unavailableReason": "The CLI is a native process, not a Node.js process."
          },
          "nodeRss": {
            "unavailableReason": "The CLI is a native process, not a Node.js process."
          },
          "nodeExternal": {
            "unavailableReason": "The CLI is a native process, not a Node.js process."
          },
          "browserJsHeap": {
            "unavailableReason": "The CLI is a native process, not a browser JavaScript environment."
          },